{
  "$schema": "http://json-schema.org/draft-07/schema#",
  "title": "FeatureWeightsConfig",
  "type": "object",
  "required": ["version", "updated_at", "normalization", "features"],
  "properties": {
    "version": { "type": "integer", "minimum": 1 },
    "updated_at": { "type": "string", "format": "date" },
    "normalization": {
      "type": "object",
      "required": ["max_raw", "scale"],
      "properties": {
        "max_raw": { "type": "integer", "minimum": 1 },
        "scale": { "type": "integer", "const": 100 }
      }
    },
    "features": {
      "type": "array",
      "minItems": 1,
      "items": {
        "type": "object",
        "required": ["id", "weight", "description"],
        "properties": {
          "id": { "type": "string", "pattern": "^[a-z_]+$" },
          "weight": { "type": "integer", "minimum": 0, "maximum": 10 },
          "description": { "type": "string", "minLength": 5 }
        }
      }
    }
  }
}
